{
	"$schema": "https://json-schema.org/draft/2020-12/schema",
	"$id": "instance_spec.schema.json",
	"title": "Instance spec (headless instance builder input)",
	"description": "A small DARP instance described as a road graph with travel times, vehicles and requests. Consumed by the headless instance builder of the graph editor (`web/graph-editor/tools/build-instance.ts`), which derives the distance matrix and writes the instance files (`config.yaml`, `requests.csv`, `vehicles.csv`, `dm.csv`, optional `vehicle_data.json`) and a picture of the instance. Node ids must be exactly 0..n-1; the checks that cannot be expressed here (unknown node references, duplicate edges, onboard requests, …) are reported by the builder.",
	"type": "object",
	"required": ["nodes", "edges"],
	"additionalProperties": false,
	"properties": {
		"nodes": {
			"type": "array",
			"minItems": 1,
			"description": "Road network nodes. Ids are the node indices used in the instance files. Positions are optional, but all nodes or none must have them; without positions the graph is laid out automatically.",
			"items": {
				"type": "object",
				"required": ["id"],
				"additionalProperties": false,
				"properties": {
					"id": { "type": "integer", "minimum": 0 },
					"x": { "type": "number", "description": "Horizontal position in layout units (`settings.layout_unit_px` pixels each, default 256); x grows to the right." },
					"y": { "type": "number", "description": "Vertical position in layout units; y grows downwards." }
				}
			}
		},
		"edges": {
			"type": "array",
			"description": "Directed road segments with their travel times. The distance matrix is the all-pairs shortest travel time over these edges.",
			"items": {
				"type": "object",
				"required": ["from", "to", "travel_time"],
				"additionalProperties": false,
				"properties": {
					"from": { "type": "integer", "minimum": 0 },
					"to": { "type": "integer", "minimum": 0 },
					"travel_time": { "type": "integer", "minimum": 0, "description": "Seconds." },
					"bidirectional": { "type": "boolean", "default": false, "description": "Also add the opposite edge with the same travel time." }
				}
			}
		},
		"vehicles": {
			"type": "array",
			"default": [],
			"description": "Vehicles; the array index is the vehicle index. For a `fleet-sizing` instance, the vehicles are not an input and go to `vehicle_data.json` instead of `vehicles.csv`.",
			"items": {
				"type": "object",
				"required": ["position", "capacity"],
				"additionalProperties": false,
				"dependentRequired": {
					"en_route_to": ["remaining_time"],
					"remaining_time": ["en_route_to"]
				},
				"properties": {
					"position": { "type": "integer", "minimum": 0, "description": "Node the vehicle is at, or the source node of the edge it travels along (`en_route_to`)." },
					"capacity": { "type": "integer", "minimum": 0 },
					"en_route_to": { "type": "integer", "minimum": 0, "description": "Target node of the edge `position → en_route_to` the vehicle is travelling along. The vehicle state is then written to `vehicle_data.json`." },
					"remaining_time": { "type": "integer", "minimum": 0, "description": "Seconds left to reach `en_route_to`; at most the travel time of the edge." },
					"onboard": {
						"type": "array",
						"description": "Requests already picked up by this vehicle (not yet dropped off). The vehicle state is then written to `vehicle_data.json`.",
						"items": {
							"type": "object",
							"required": ["request"],
							"additionalProperties": false,
							"properties": {
								"request": { "type": "integer", "minimum": 0, "description": "Request id." },
								"pickup_time": { "type": "integer", "minimum": 0, "description": "Seconds; when absent, the request is assumed to be picked up as late as possible (shortest drive from its origin to the vehicle position)." }
							}
						}
					}
				}
			}
		},
		"requests": {
			"type": "array",
			"default": [],
			"items": {
				"type": "object",
				"required": ["id", "origin", "destination", "time"],
				"additionalProperties": false,
				"properties": {
					"id": { "type": "integer", "minimum": 0 },
					"origin": { "type": "integer", "minimum": 0, "description": "Pickup node." },
					"destination": { "type": "integer", "minimum": 0, "description": "Drop-off node; must differ from `origin`." },
					"time": { "type": "integer", "minimum": 0, "description": "Desired pickup time in seconds." }
				}
			}
		},
		"settings": {
			"type": "object",
			"additionalProperties": false,
			"properties": {
				"problem": { "type": "string", "enum": ["DARP", "fleet-sizing"], "default": "DARP" },
				"max_delay_seconds": { "type": "integer", "minimum": 0, "description": "Written as `max_delay` (absolute mode) to `config.yaml`; absent = no maximum delay." },
				"current_time": { "type": "integer", "minimum": 0, "description": "Current time of the instance (seconds) when vehicles carry requests; absent = derived from the onboard requests. Written as the vehicles' `operation_start`." },
				"layout_unit_px": { "type": "number", "exclusiveMinimum": 0, "default": 256, "description": "Pixels per layout unit of the node positions in the picture." }
			}
		}
	}
}
