{
  "nodes": [{ "id": 0 }, { "id": 1 }, { "id": 2 }, { "id": 3 }, { "id": 4 }],
  "edges": [
    { "from": 0, "to": 1, "travel_time": 100, "bidirectional": true },
    { "from": 1, "to": 2, "travel_time": 100, "bidirectional": true },
    { "from": 2, "to": 3, "travel_time": 100, "bidirectional": true },
    { "from": 3, "to": 4, "travel_time": 100, "bidirectional": true },
    { "from": 4, "to": 0, "travel_time": 100, "bidirectional": true }
  ],
  "requests": [
    { "id": 0, "origin": 0, "destination": 2, "time": 0 },
    { "id": 1, "origin": 1, "destination": 3, "time": 60 },
    { "id": 2, "origin": 4, "destination": 1, "time": 120 }
  ],
  "settings": { "problem": "fleet-sizing", "max_delay_seconds": 240 }
}
